{
  "schema_version": "1.0.0",
  "evaluation_id": "evaluation.r5.operational-v1",
  "evaluated_at": "2026-07-21T02:52:07+09:00",
  "source_evaluation_path": "evaluation/operations/r5_acceptance.json",
  "source_evaluation_sha256": "1f2e07a7dbc1bc1ff272dfa83a338da7dcdf778fa7a53db5cfd0841f825c59e4",
  "scenarios": [
    {
      "scenario_id": "r5.01.file-lifecycle",
      "scenario_kind": "file_lifecycle",
      "passed": true,
      "evidence": {
        "states": [
          "created",
          "modified",
          "moved",
          "deleted"
        ],
        "final_file_exists": false,
        "success_events": 4,
        "event_types": [
          "write_applied",
          "write_applied",
          "lifecycle_applied",
          "lifecycle_applied"
        ]
      },
      "error": null
    },
    {
      "scenario_id": "r5.02.source-review-transition",
      "scenario_kind": "source_review_transition",
      "passed": true,
      "evidence": {
        "detected_source_status": "needs_review",
        "detected_knowledge_status": "needs_review",
        "reviewed_source_status": "active",
        "reviewed_knowledge_status": "verified",
        "review_records": 4,
        "revision_records": 4
      },
      "error": null
    },
    {
      "scenario_id": "r5.03.conflict-supersession-coexistence",
      "scenario_kind": "conflict_supersession_coexistence",
      "passed": true,
      "evidence": {
        "knowledge_ids": [
          "knowledge.r5.alpha",
          "knowledge.r5.beta",
          "knowledge.r5.gamma"
        ],
        "relation_types": [
          "contradicted_by",
          "supersedes"
        ],
        "superseded_status": "superseded",
        "replacement_status": "candidate",
        "conflicting_record_preserved": true
      },
      "error": null
    },
    {
      "scenario_id": "r5.04.partial-failure-resume",
      "scenario_kind": "partial_failure_resume",
      "passed": true,
      "evidence": {
        "rollback": "success",
        "rollback_contents": [
          "a-before",
          "b-before"
        ],
        "retry_event_type": "write_retried",
        "retry_of_event_id": "event.write-failed.0001",
        "final_contents": [
          "a-after",
          "b-after"
        ]
      },
      "error": null
    },
    {
      "scenario_id": "r5.05.index-delete-cold-rebuild",
      "scenario_kind": "index_delete_cold_rebuild",
      "passed": true,
      "evidence": {
        "recorded_r4_logical_result_hash": "006bd8f314be6dbf9ff620a0c7764054a1704f2deb59b424bc61f48ac24d213d",
        "before_rebuild_logical_result_hash": "5f2d98fa0b92eb1b8b4e46e3b259e2175c5245bb13df8ddcbc26788ddfb04ff1",
        "after_rebuild_logical_result_hash": "5f2d98fa0b92eb1b8b4e46e3b259e2175c5245bb13df8ddcbc26788ddfb04ff1",
        "fts_decision": "not_needed_baseline_passed",
        "physical_search_indexes": 0,
        "deleted_projections": [
          "catalog/rules.jsonl",
          "catalog/records.jsonl",
          "catalog/units.jsonl",
          "evaluation/retrieval/r4_baseline_result.json"
        ],
        "absent_before_rebuild": true,
        "rebuilt_projections_exist": true,
        "query_differences": {}
      },
      "error": null
    },
    {
      "scenario_id": "r5.06.new-session-cold-start",
      "scenario_kind": "new_session_cold_start",
      "passed": true,
      "evidence": {
        "same_revision_manifest": true,
        "same_selection_ids": true,
        "same_selection_fingerprint": true,
        "selection_fingerprint": "f4ead7e0470bcb36000cda77a6e7b61821ebba739518a8a17c6536a16ca75b6f",
        "revision_differences": {}
      },
      "error": null
    },
    {
      "scenario_id": "r5.07.protected-namespace-isolation",
      "scenario_kind": "protected_namespace_isolation",
      "passed": true,
      "evidence": {
        "authorized_manifest_paths": [
          "inputs/r5-video-task/source.mp4"
        ],
        "unauthorized_rejected": true,
        "global_catalog_entries": 0,
        "reuse_after_close": "rejected",
        "scope_close_event": "event.protected-scope-closed.0060",
        "data_deleted": false,
        "authorized_content_hash": "3d6c282d6a7cf418db0fd4b5db70cef5e1c7ebeb4a168135718edac32e0397bf"
      },
      "error": null
    },
    {
      "scenario_id": "r5.08.real-task-leakage",
      "scenario_kind": "real_task_leakage",
      "passed": true,
      "evidence": {
        "tasks": [
          {
            "task_label": "report",
            "selected_rule_ids": [
              "rule.provenance.claim-classification",
              "rule.provenance.preserve-source-language",
              "rule.provenance.source-and-rationale",
              "rule.retrieval.default-exclusions",
              "rule.retrieval.direct-routing-first",
              "rule.retrieval.minimum-context"
            ],
            "selected_file_paths": [
              "PROJECT_RULES.md",
              "docs/reports/2026-07-21_R-4_검색_평가_결과.md",
              "rules/provenance.md",
              "rules/retrieval.md"
            ],
            "unexpected_rule_ids": [],
            "unexpected_file_paths": [],
            "missing_rule_ids": [],
            "missing_file_paths": [],
            "leakage": 0
          },
          {
            "task_label": "knowledge",
            "selected_rule_ids": [
              "rule.knowledge.confidence-is-not-verification",
              "rule.knowledge.preserve-conflicts",
              "rule.provenance.claim-classification",
              "rule.provenance.source-and-rationale",
              "rule.retrieval.default-exclusions",
              "rule.retrieval.direct-routing-first",
              "rule.retrieval.minimum-context"
            ],
            "selected_file_paths": [
              "PROJECT_RULES.md",
              "knowledge/items.jsonl",
              "rules/knowledge.md",
              "rules/provenance.md",
              "rules/retrieval.md"
            ],
            "unexpected_rule_ids": [],
            "unexpected_file_paths": [],
            "missing_rule_ids": [],
            "missing_file_paths": [],
            "leakage": 0
          },
          {
            "task_label": "video",
            "selected_rule_ids": [
              "rule.retrieval.default-exclusions",
              "rule.retrieval.direct-routing-first",
              "rule.retrieval.minimum-context"
            ],
            "selected_file_paths": [
              "PROJECT_RULES.md",
              "inputs/r5-video-task/source.mp4",
              "rules/retrieval.md"
            ],
            "unexpected_rule_ids": [],
            "unexpected_file_paths": [],
            "missing_rule_ids": [],
            "missing_file_paths": [],
            "leakage": 0
          }
        ],
        "rule_file_leakage": 0,
        "exact_selection": true
      },
      "error": null
    },
    {
      "scenario_id": "r5.09.feedback-next-context",
      "scenario_kind": "feedback_next_context",
      "passed": true,
      "evidence": {
        "pre_review_selected": false,
        "post_review_selected": true,
        "required_event_types_present": [
          "context_resolved",
          "record_lifecycle",
          "record_reviewed"
        ],
        "selected_record_ids": [
          "knowledge.r5.feedback",
          "source.repo.project-rules"
        ]
      },
      "error": null
    }
  ],
  "logical_result_hash": "9355209f8759f6cf105c630c2a58e44068d20613a66372d93eed9778f378781f",
  "summary": {
    "scenarios": 9,
    "passed": 9,
    "failed": 0,
    "rule_file_leakage": 0
  },
  "ok": true
}
